{"schema_version":"1.0.0","digest_id":"B-06-PROGRESS-HANDOFF-DIGEST-START","package_id":"B-06","event_sequence":264,"algorithm":"SHA-256","progress":{"path":"docs/progress/build-progress.json","bytes":43792,"file_sha256":"5D146ED9F22277F3FCC40F97280CE0F974B5AF39A9BAD36A52A97E17EF03712C","canonical_json_sha256":"8651B6ABC258365387AA7DFAB7FE5104A235403B588F2DB0DEA2C1F80028415D"},"handoff":{"path":"docs/progress/BUILD_HANDOFF.md","bytes":84029,"file_sha256":"9BF3B6B1BDB88F2CCD5995E08782FE53695112F8A1FE635F35225C756C03C347","machine_summary_canonical_sha256":"6AB60007F7765BFF4E1B544186852090E62F5B3E8C82DC58C2D4B321331AA852"},"created_at":"2026-08-15T09:00:03+09:00","scope":"B-06 fenced start; Developer product exact15; Main projection exact15; product and runtime NOT_EXECUTED; isolated WSL Anvil DB only during Developer implementation validation"}
