{"schema_version":"1.0.0","digest_id":"B-09-PROGRESS-HANDOFF-DIGEST-REWORK-COMPLETION-R5","package_id":"B-09","event_sequence":311,"algorithm":"SHA-256","progress":{"path":"docs/progress/build-progress.json","bytes":47292,"file_sha256":"555BA0FE677DC1AA929CCE739E2B9F329717EBAE5A7195DD5C3D08779E506C60","canonical_json_sha256":"35846FD56A4967FE228BFB77BCC0D448583C6E9392041EE4DCD67159253DD16A"},"handoff":{"path":"docs/progress/BUILD_HANDOFF.md","bytes":100643,"file_sha256":"8E9E16354D5A40AA6DA531DAC8F53F2CCCAC37472B668DFC4A484E6CD39611D6","machine_summary_canonical_sha256":"55D72EDED0A368D89BFDF18229EE03B89C3E3AB88CBDF4169238C00EA2434356"},"created_at":"2026-08-20T20:30:02+09:00","scope":"B-09 Main R5 rework completed; epoch-5 leases revoked; independent retest pending; frozen product exact15; B-10 blocked; product mutation zero after freeze"}
