{
  "schema_version": "1.0.0",
  "digest_id": "PHASE-B-GATE-PROGRESS-HANDOFF-DIGEST-REWORK-R2",
  "package_id": "PHASE_B_GATE",
  "event_sequence": 374,
  "algorithm": "SHA-256",
  "progress": {
    "path": "docs/progress/build-progress.json",
    "bytes": 52385,
    "file_sha256": "9BD978FD58AEA2DF7E1CCAD990007DEFDA90959E9780F42F0B1E5211350C3B32",
    "canonical_json_sha256": "E9F28741C0A29A7EA487D0C09BF1A7FA9B5F2CF38676CD31FA76640A2C02A913"
  },
  "handoff": {
    "path": "docs/progress/BUILD_HANDOFF.md",
    "bytes": 118530,
    "file_sha256": "CD741D2CC15AAB27C84A1499BD2EF73B76E4B43771FB297EF7E9207908BF9E11",
    "machine_summary_canonical_sha256": "B1505CBB2A6DD6D32DBB9F5A5A5113411D1DBF61DB71C67DD938464D47872F68"
  },
  "created_at": "2026-08-22T00:20:00+09:00",
  "scope": "Phase B Gate exact44 R3 rework active; C-01 blocked pending independent review and Main Gate decision"
}
