{
  "schema_version": "1.0.0",
  "digest_id": "A-09-PROGRESS-HANDOFF-DIGEST-ACCEPTED",
  "package_id": "A-09",
  "event_sequence": 113,
  "algorithm": "SHA-256",
  "progress": {"path": "docs/progress/build-progress.json", "bytes": 17753, "file_sha256": "17300C58D45FBBC2AEDAC8187038B9A575823568E9DBCA9ED0316FBB555E9617", "canonical_json_sha256": "EFD3E388FA83FA6FA380D48968BB7A82A0160494118AF25C2A5729A2860774FB"},
  "handoff": {"path": "docs/progress/BUILD_HANDOFF.md", "bytes": 44297, "file_sha256": "72D796EB15B3FBA100262109786B360E75CD0A961825F6B291497F6B87C7BAE8", "machine_summary_canonical_sha256": "A67D9B5F0E42FBEA94C1E374591D2DD8C68BE2FD80B5DF8E48FC3FBD4A261916"},
  "created_at": "2026-08-12T06:00:00+09:00",
  "scope": "A-09 Main acceptance and A-10 READY projection; Skill activation, Hook activation, runtime, and DIR NOT_EXECUTED"
}
