{
  "schema_version": "1.0.0",
  "digest_id": "A-04-PROGRESS-HANDOFF-DIGEST-ACCEPTED",
  "package_id": "A-04",
  "event_sequence": 78,
  "algorithm": "SHA-256",
  "progress": {"path": "docs/progress/build-progress.json", "bytes": 13219, "file_sha256": "49AEC80DED197F479B1C4C6A33935340E86A6C134079A08C095D19CCE7E44E24", "canonical_json_sha256": "9FEF9A3495CF3D3F94C481476A6E434D31F7875B988191D35F31DA703325F61A"},
  "handoff": {"path": "docs/progress/BUILD_HANDOFF.md", "bytes": 35521, "file_sha256": "294994F8BA37046CFF7B38258F43ABCAD9FB7CC9E05C0F3D29A11515E6E17387", "machine_summary_canonical_sha256": "A891F2935A02B745AEE3BDFC523D5BFEDF934393DAF57827E28BED4FADA5D71E"},
  "created_at": "2026-08-11T17:55:14+09:00",
  "scope": "A-04 Main acceptance; independent Tester PASS bound, A-05 READY without dispatch, canonical L7 remains RUNTIME_DEFERRED NOT_EXECUTED"
}
