{"schema_version":"1.0.0","digest_id":"B-05-PROGRESS-HANDOFF-DIGEST-START","package_id":"B-05","event_sequence":252,"algorithm":"SHA-256","progress":{"path":"docs/progress/build-progress.json","bytes":40504,"file_sha256":"BD663395539F9D21E78EF7E5F4DDE8DFEBCC0C5F6F3D3A8529AAE27EC0A66909","canonical_json_sha256":"9105D9F7F7349073BF1E5D96B7548EE07A8C38D4B95FF611EEFEE3A23611F9F2"},"handoff":{"path":"docs/progress/BUILD_HANDOFF.md","bytes":80170,"file_sha256":"C1528D2700C55330381B425A9FBA049B196E32195324076518EC8ECA0AED52CF","machine_summary_canonical_sha256":"BCFB2578919A70812C0E9C366C5DC566213A13D5141D3BA5FD588C83F2EE94ED"},"created_at":"2026-08-15T04:30:03+09:00","scope":"B-05 fenced start; Developer product exact15; Main projection exact15; product and runtime NOT_EXECUTED; isolated WSL Anvil DB only during Developer implementation validation"}
